{
  "schema_version": 1,
  "project_id": "sample-landsat-bus",
  "project_name": "Landsat Multispectral Scanner Bus (sample)",
  "updated_at": "2026-05-20T12:00:00+00:00",
  "extraction_source": "manual",
  "mission": {
    "mass_kg": 847,
    "orbit_altitude_km": 705,
    "orbit_inclination_deg": 98.2,
    "power_budget_w": 420,
    "fairing_diameter_m": 2.35,
    "deployable_span_m": 2.8,
    "design_life_years": 5,
    "cg_x_mm": 4.2,
    "cg_y_mm": -2.1,
    "cg_z_mm": 520,
    "moi_ixx_kgm2": 312,
    "moi_iyy_kgm2": 298,
    "moi_izz_kgm2": 145,
    "interface_type": "paf_1575",
    "primary_lateral_hz": 14.5,
    "primary_axial_hz": 28.0,
    "vent_area_m2": 0.0025,
    "sealed_volume_m3": 0.85,
    "max_q_pa": 4500,
    "factor_of_safety_structural": 2.0
  },
  "components": [
    {
      "component_id": "bus_primary",
      "node_id": "bus_primary",
      "name": "Primary Structure Deck",
      "subsystem": "Structure",
      "kind": "frame",
      "mass_kg": 285,
      "length_m": 1.2,
      "width_m": 1.0,
      "height_m": 0.15,
      "power_w": 0,
      "material": "aluminum",
      "bbox_x_px": 120,
      "bbox_y_px": 100,
      "bbox_w_px": 200,
      "bbox_h_px": 180
    },
    {
      "component_id": "solar_array_port",
      "node_id": "solar_port",
      "name": "Solar Array (port)",
      "subsystem": "Power",
      "kind": "panel",
      "mass_kg": 95,
      "length_m": 2.4,
      "width_m": 0.9,
      "height_m": 0.03,
      "power_w": 280,
      "material": "composite",
      "bbox_x_px": 20,
      "bbox_y_px": 90,
      "bbox_w_px": 80,
      "bbox_h_px": 200
    },
    {
      "component_id": "solar_array_stbd",
      "node_id": "solar_stbd",
      "name": "Solar Array (starboard)",
      "subsystem": "Power",
      "kind": "panel",
      "mass_kg": 95,
      "length_m": 2.4,
      "width_m": 0.9,
      "height_m": 0.03,
      "power_w": 280,
      "material": "composite",
      "bbox_x_px": 340,
      "bbox_y_px": 90,
      "bbox_w_px": 80,
      "bbox_h_px": 200
    },
    {
      "component_id": "payload_mss",
      "node_id": "mss",
      "name": "Multispectral Scanner",
      "subsystem": "Payload",
      "kind": "instrument",
      "mass_kg": 180,
      "length_m": 0.6,
      "width_m": 0.5,
      "height_m": 0.45,
      "power_w": 85,
      "material": "aluminum",
      "bbox_x_px": 160,
      "bbox_y_px": 140,
      "bbox_w_px": 120,
      "bbox_h_px": 100
    },
    {
      "component_id": "propulsion_module",
      "node_id": "prop",
      "name": "Hydrazine Propulsion Module",
      "subsystem": "Propulsion",
      "kind": "tank",
      "mass_kg": 120,
      "length_m": 0.5,
      "width_m": 0.4,
      "height_m": 0.35,
      "power_w": 15,
      "material": "titanium",
      "bbox_x_px": 200,
      "bbox_y_px": 280,
      "bbox_w_px": 100,
      "bbox_h_px": 80
    },
    {
      "component_id": "adcs_cluster",
      "node_id": "adcs",
      "name": "ADCS & Avionics Bay",
      "subsystem": "ADCS",
      "kind": "avionics",
      "mass_kg": 72,
      "length_m": 0.35,
      "width_m": 0.35,
      "height_m": 0.25,
      "power_w": 40,
      "material": "aluminum",
      "bbox_x_px": 180,
      "bbox_y_px": 60,
      "bbox_w_px": 90,
      "bbox_h_px": 70
    }
  ],
  "launch_vehicle_preferences": {
    "preferred_vehicle_id": "f9",
    "target_orbit": "sso"
  },
  "check_readiness": {
    "ready_count": 16,
    "blocked_count": 0,
    "missing_mission_fields": [],
    "missing_component_fields": [],
    "tests_unblocked": [
      "mass_capacity",
      "orbit_delta_v",
      "center_of_gravity",
      "moments_of_inertia",
      "static_envelope",
      "dynamic_envelope",
      "modal_lateral",
      "modal_axial",
      "quasi_static_loads",
      "random_vibration",
      "sine_vibration",
      "acoustic",
      "shock_srs",
      "structural_stress",
      "thermal_ascent",
      "depressurization"
    ]
  }
}
